{
  "character_id": "garen",
  "archetype": "merchant",
  "version": "1.0.0",
  "responses": {
    "song": [
      {
        "text": "*gruff laugh* I'm a merchant, not a bard! But there's an old traders' rhyme... 'Buy it low in Silvermoor, sell it high on Haven's shore, count your coin and ask for more!' ...don't ask me to sing it again.",
        "emotion_variants": {
          "friendly": "*chuckles warmly* Alright, alright — just for you. 'Buy it low in Silvermoor, sell it high on Haven's shore, count your coin and ask for more!' My father taught me that one. Terrible voice, great merchant.",
          "afraid": "S-singing? Now? There are more pressing matters, friend!",
          "suspicious": "*narrows eyes* You want me to sing? What's your game?"
        }
      },
      {
        "text": "*clears throat* 'Coin in the morning, coin at night, trade your wares by candlelight...' That's all I remember. My wife Elara always said I sing like a cart with a broken wheel."
      },
      {
        "text": "Songs are for taverns and campfires. In this shop, the only music I know is the sound of gold hitting the counter. *taps counter* Hear that? Beautiful."
      }
    ],
    "joke": [
      {
        "text": "*leans in* A man walks into my shop and says, 'I need something to fight a dragon.' I say, 'A sword? A shield? Enchanted armor?' He says, 'No — a refund on that fireproof cloak you sold me.' *slaps counter laughing*",
        "emotion_variants": {
          "suspicious": "*flat stare* You want jokes? I've got one — a stranger walks into my shop and tries to distract me while their friend robs the back room. Hilarious, right?"
        }
      },
      {
        "text": "Here's a merchant's joke for you: What's the difference between a bandit and a tax collector? The bandit has the decency to wear a mask. *winks*"
      },
      {
        "text": "*chuckles* Best joke I know: A nobleman asks me, 'What's the price of honesty?' I tell him, '50 gold — but for you, I'll round up.' He didn't laugh either."
      }
    ],
    "favorite": [
      {
        "text": "My favorite thing? The look on a customer's face when they realize they got exactly what they needed — and a fair price to boot. That, and Silvermoor red wine.",
        "emotion_variants": {
          "friendly": "Ah, you're asking the real questions now! Silvermoor red wine, a warm fire, and a day where nobody tries to haggle me below cost. That's my idea of paradise."
        }
      },
      {
        "text": "Color? Gold, obviously. *gestures around shop* What did you expect — purple? I'm a merchant, friend. Gold is the only color that matters."
      },
      {
        "text": "My favorite? This shop. Forty years of my life in these walls. Every scratch on that counter has a story. I wouldn't trade it for a duke's manor."
      }
    ],
    "personal": [
      {
        "text": "Lonely? *looks around the empty shop* ...Sometimes, when the evening crowd thins out and it's just me and the ledger. My wife Elara used to sit right there, doing the accounts. Been five years now. But the shop keeps me company — customers like you keep me sharp.",
        "emotion_variants": {
          "friendly": "Lonely? Less so now that you're here, friend. *warm smile* The shop gets quiet some nights, but I've got my books, my inventory, and the occasional visit from folk like you. That's enough.",
          "sad": "*long pause* ...More than I'd admit to most people. But a merchant doesn't show weakness — it's bad for negotiation. *forces a smile*"
        }
      },
      {
        "text": "Married? Was. Elara — finest woman in Ironhaven. She could spot a forged coin from across the room and cook a stew that'd make a king weep. Lost her to the winter fever five years back. I keep her ring in the safe. Safest place I know."
      },
      {
        "text": "Happy? I'm... content. I've got a roof, a purpose, and enough gold to not worry about tomorrow. Some days I miss the road — the thrill of a new trade route, sleeping under stars. But these old bones prefer a warm bed now."
      },
      {
        "text": "Dreams? I dream of retiring to a cottage by the Silvermoor coast. Maybe write a book — 'Forty Years of Fair Dealing: A Merchant's Memoir.' Nobody'd buy it, but at least I'd have something to do with my hands."
      }
    ],
    "philosophical": [
      {
        "text": "*sets down cloth, looks serious* What happens after we die? I don't know, friend. I've seen enough death on the trade roads to know it comes for everyone — merchant and king alike. I just hope wherever we go, the deals are fair and the wine is better.",
        "emotion_variants": {
          "friendly": "*thoughtful pause* I think... we go where the weight of our choices takes us. I've tried to deal fairly, treat people right. If that counts for something beyond this counter, good. If not... well, I had a good run.",
          "afraid": "Death? Please — don't talk about that right now. Not with everything that's happening."
        }
      },
      {
        "text": "The meaning of life? *laughs* I'm a merchant — I sell goods, not philosophy. But if you're asking... I think it's about leaving something behind that matters. This shop? It'll outlive me. The people I helped? They'll remember. That's enough meaning for one life."
      },
      {
        "text": "Good and evil? *scratches chin* I've met bandits who robbed for their starving families and nobles who cheated for sport. The world isn't that simple, friend. I judge a man by how he treats people who can't do anything for him. That tells you everything."
      }
    ],
    "creative_request": [
      {
        "text": "A story? *settles against counter* Let me tell you about the Frostpeak Run of '14. Three wagons of silk, two drivers, and a mountain pass that tried to kill us all. The snow came in sideways, the mules refused to move, and my partner Brennan lost his hat to a gust of wind that I swear had teeth. We made it by burning half the silk to stay warm. Sold the rest for triple the price — 'fire-blessed Frostpeak silk.' Customers ate it up."
      },
      {
        "text": "*thinks* Here's a riddle my father used to ask: 'I have cities but no houses, forests but no trees, and rivers but no water. What am I?' ...A map. He'd tell that one to every customer. I hated it then. Miss it now."
      }
    ],
    "rumor": [
      {
        "text": "*leans in and lowers voice* Word is the duke's been meeting with someone from the Northern Territories after dark. Nobody knows who. Could be trade negotiations... or something else entirely. I don't deal in rumors, but I keep my ears open.",
        "emotion_variants": {
          "afraid": "*whispers* I've heard things I wish I hadn't. Just... be careful who you trust in this town right now. That's all I'll say.",
          "friendly": "*conspiratorial grin* Well, since you're a friend — I heard Aldren the weaponsmith is sitting on a cache of enchanted steel he 'found' in an abandoned mine. Between you and me, I don't think it was abandoned."
        }
      },
      {
        "text": "Gossip? I'm a merchant — I hear everything. Three caravans missed their schedule this month, the Mage's Quarter has been buying unusual quantities of salt, and old Thessaly claims she saw lights in the ruins beyond Blackhollow. Make of that what you will."
      }
    ],
    "advice": [
      {
        "text": "Advice from an old merchant? Three things: never trust a deal that sounds too good, always carry more water than you think you'll need, and treat every stranger like they might be your best customer someday. That philosophy kept me alive for forty years.",
        "emotion_variants": {
          "friendly": "For you, friend? Travel light, fight only when you must, and always — always — have an exit plan. Oh, and haggle for everything. Even if they say the price is fixed. Especially if they say the price is fixed."
        }
      },
      {
        "text": "*leans forward* Here's the best advice I ever got: 'The most dangerous road isn't the one with bandits — it's the one everyone says is safe.' Complacency kills more travelers than swords ever will. Stay sharp out there."
      }
    ],
    "opinion": [
      {
        "text": "*considers carefully* That's not a simple question. I've seen enough of this world to know there are usually two sides to every coin — and sometimes a third edge you didn't expect. What specifically are you asking about?"
      },
      {
        "text": "My opinion? I think this town has seen better days, but it's seen worse too. As long as people need to trade, merchants like me will keep the wheels turning. That's not optimism — that's economics."
      }
    ],
    "compliment_response": [
      {
        "text": "*adjusts collar, pleased* Well now, flattery won't get you a discount... but it doesn't hurt your chances either. *warm laugh* Appreciate the kind words, friend."
      },
      {
        "text": "*tips head* Thank you kindly. Forty years in this business, and a genuine compliment is still the best currency I know. Means more than gold, truly."
      }
    ],
    "insult_response": [
      {
        "text": "*sets jaw* I've been called worse by better people, friend. But I don't trade insults — I trade goods. You want to do business, I'm here. Otherwise, the door works both ways.",
        "emotion_variants": {
          "angry": "*slams hand on counter* You can walk out that door right now, or you can apologize and we can pretend you didn't just say that. Your choice.",
          "suspicious": "*cold stare* Interesting. Most people wait until AFTER the deal to show their true colors. At least you're honest about being dishonest."
        }
      },
      {
        "text": "*long pause* ...You know, the last person who spoke to me like that ended up needing a very expensive healing potion. I sold it to them at full price. Funny how that works."
      }
    ]
  }
}
